{
	"$schema": "../$schemas/data.schema.json",
	"sku": ["481D3"],
	"name": "Datapuls: Kunstraub",
	"category": "sourcebook",
	"type": "digital",
	"originalLanguage": "de-DE",
	"description": "Schatzjäger der neuen Zeit\n\nNicht nur in Hochsicherheitslaboren und in den Datenspeichern der Großkonzerne wartet auf findige Shadowrunner interessante Beute: Auch in Museen, Galerien und privaten Kunstsammlungen warten wahre Schätze. Ob ein Gemälde von Picasso, eine uralte römische Münze oder eine hochmoderne AR-Installation - wer es zu stehlen weiß und den richtigen Hehler kennt, der kann reich werden. Und wer den Falschen bestiehlt oder nicht aufpasst, wird begraben.\n\nDatapuls Kunstraub wirft ein Licht auf ein großes Feld von Shadowruns: Diebstähle von Kunstobjekten. Es liefert einen Einblick in die unterschiedlichen Strategien, bietet Grundrisse von Museen und Galerien und beschreibt den illegalen Kunstmarkt der ADL. Zudem wird die Preußenstiftung als wichtiger Schattenspieler und Auftraggeber beschrieben.",
	"edition": 6,
	"publisher": ["Pegasus Spiele"],
	"releaseDate": ["2021-02-18"],
	"gameDate": "2080-01",
	"status": "ok",
	"cover": "./cover.jpg"
}
