{
	"$schema": "../$schemas/data.schema.json",
	"sku": ["45067"],
	"name": "Ebbe und Flut",
	"category": "mission",
	"type": "digital",
	"originalLanguage": "de-DE",
	"description": "Hamburg kennt viele Arten von Wasser. Trübes Wasser, Brackwasser, steigendes und fallendes Wasser. Giftiges Wasser. Und in den wenigsten lauert etwas Gutes. Wer im Sprawl an der Waterkant Runs durchführt und in seinen Schatten Geld verdienen möchte, sollte auf nasse Überraschungen vorbereitet sein: auf dunkle Geheimnisse im Watt und auf Verfolgungsjagden durch die Kanäle von Wildost. Aber auch an Land warten Bedrohungen - selbst hinter den Kulissen der allgegenwärtigen Vergnügungen.\nEbbe und Flut ist ein Abenteuerband mit drei Abenteuern für Shadowrun 5, die in die Schatten Hamburgs führen. Die Runner begleiten Combat-Golfer bei Hole in One, untersuchen merkwürdige Vorkommnisse An der Nordseeküste und erleben Abenteuer Im Schatten der Scheinwerfer. Alle Abenteuer sind komplett spielfertig, inklusive Grundrisszeichnungen und Pläne. Es handelt sich um eine Eigenproduktion von Pegasus Press.",
	"edition": 5,
	"publisher": ["Pegasus Spiele"],
	"releaseDate": ["2018-10-07"],
	"gameDate": "2075-01",
	"status": "ok",
	"cover": "./cover.jpg"
}
