{
	"$schema": "../$schemas/data.schema.json",
	"sku": ["483DA2"],
	"name": "Datapuls: SOTA 2083",
	"category": "sourcebook",
	"type": "digital",
	"originalLanguage": "de",
	"description": "Neue Ausrüstung braucht das Land\n\nMag auch die Welt untergehen: Es braucht schon etwas mehr, um Konzerne daran zu hindern, neue Tech auf den Markt zu werfen. Vom fliegenden BMW-Sportwagen über das schwimmfähige Quad bis zur Hightech-Maikäfer-Drohne liefert dir dieser Datapuls alles, was die 2082er-Messen für 2083 angekündigt haben. Plus SR6-Werte für Plex-Cabs, oTTo-Trolltaxis, Proteus-Mini-U-Boote und vieles mehr.",
	"edition": 6,
	"publisher": ["Pegasus Spiele"],
	"releaseDate": ["2024-03-28"],
	"gameDate": "2082-01",
	"status": "missing",
	"cover": "./cover.jpg"
}
