{
	"$schema": "../$schemas/data.schema.json",
	"sku": ["3890645704"],
	"name": "Elementares Wissen",
	"category": "novel",
	"type": "digital",
	"originalLanguage": "de-DE",
	"description": "Das Runnerteam Pik-Dame existiert nicht mehr. Paul, Pandora, Claw, Zack, Snap und Chet gehen längst ihre eigenen Wege. Doch dann taucht eine alte Bedrohung aus der gemeinsamen Vergangenheit auf und zwingt die Runner, sich wieder zusammenzuschließen. Die Feinde sind heute mächtiger als je zuvor — und es gibt sogar Anzeichen dafür, dass ein Verräter in den eigenen Reihen lauert.\n\nElementares Wissen ist der Abschluss und Höhepunkt von Harri Aßmanns Nordlichter-Trilogie.",
	"edition": 2,
	"publisher": ["Heyne Verlag"],
	"releaseDate": ["2002-01-01", "2004-01-01"],
	"gameDate": "2050-01",
	"status": "ok",
	"cover": "./cover.jpg"
}
