{
	"$schema": "../$schemas/data.schema.json",
	"sku": ["481D2"],
	"name": "Datapuls: Magische Orte",
	"category": "sourcebook",
	"type": "digital",
	"originalLanguage": "de-DE",
	"description": "Alte Geister, neue Mächte\n\nWo die Magie zum Leben erwacht und mit ihr die vergessenen Mythen, die dunklen Geheimnisse und die finsteren Kulte der Vergangenheit, da werden friedliche Orte und Touristenziele plötzlich zu magischen Hotspots. In der Sechsten Welt verändert sich alles - und so werden aus alten Gemäuern Spukhäuser, aus Sagengestalten echte Geister und aus alten Geschichten Wahrheiten, die einen Nachts in finsteren Träumen jagen.\n\nDatapuls Magische Orte wirft ein Licht auf unterschiedliche Orte der ADL, die nach Wiederkehren der Magie zu neuem Leben erwacht sind: Naturplätzen wie die Atta-Höhle, alte Ritualorte wie das Ringheiligtum von Pömmelte und Mythen der neueren Geschichte wie die Pfaueninsel. Mehr als zwanzig solcher magischen Plätze in der ADL, Österreich und der Schweiz werden beschrieben - einige mit Grundriss - und können als Schauplatz für Szenen oder ganze Runs dienen.",
	"edition": 6,
	"publisher": ["Pegasus Spiele"],
	"releaseDate": ["2021-02-18"],
	"gameDate": "2080-01",
	"status": "ok",
	"cover": "./cover.jpg"
}
