{
	"$schema": "../$schemas/data.schema.json",
	"sku": ["AUG002"],
	"name": "Augment 02 [Summer 2083]",
	"category": "magazine",
	"type": "digital",
	"originalLanguage": "en",
	"description": "Augment is Shadowrunâ€™s official magazine. This is a fully in-universe publication, and can be used in Shadowrun games as well as enjoyed by the casual reader.\n\nAugment, Summer 2083. The Matrix is magic, and Augment proves it in this issue. Discover the newest deck to hit the market while listening to Ares VP Karen King and Marques Reille go toe-to-toe. Art Director Denidra Boann shares her insights into the art of the page as Hunter Cobb continues to follow the story behind the Tailgate Riots in Denver! Enjoy reviews of new products, clothing, tech, and so much more!\n\nAugment your life with Augment magazine!",
	"edition": 6,
	"publisher": ["Catalyst Game Labs"],
	"releaseDate": ["2025-05-16"],
	"gameDate": "2082-01",
	"status": "ok",
	"cover": "./cover.jpg"
}
