{
	"$schema": "../$schemas/data.schema.json",
	"sku": ["5496", "27806"],
	"name": "Worlds Without End",
	"category": "novel",
	"type": "digital",
	"names": { "de-DE": "Die endlosen Welten" },
	"originalLanguage": "en-US",
	"description": "Spawned in the realm between the worlds, a Horror comes.\nDefeated in battle centuries before by the elven mage Aina, it walks again, seeking vengeance on the mortal lands.\nIf Aina fails to convince the courts of Tir na nOg and Tir Tairngire of the danger, she will have to face the Horror alone once more--or watch the world end.\n<small>NOTE: This story was originally written to conclude the Immortals trilogy; of which the first two parts were <em>Earthdawn</em> novels still unpublished at the time. <strong><em>Scars</em></strong> was published in 2005, and <strong><em>Little Treasures</em></strong> remains unpublished in English.</small>",
	"edition": 2,
	"publisher": ["FASA Corporation", "Catalyst Game Labs", "Heyne Verlag"],
	"releaseDate": ["1995-10-01", "2003-06-01"],
	"gameDate": "2056-01",
	"status": "ok",
	"cover": "./cover.jpg"
}
