{
	"$schema": "../$schemas/data.schema.json",
	"sku": ["27511", "45049"],
	"name": "Sixth World Tarot",
	"category": "misc",
	"type": "print",
	"names": { "de-DE": "Tarot der Sechsten Welt" },
	"originalLanguage": "en-US",
	"description": "The Sixth World Tarot Deck for Shadowrun is much more than just a tarot deck. Created by Echo and Lazarus Chernik for Catalyst Game Labs, the deck is a multi-tiered, masterfully illustrated game accessory for Shadowrun, Fifth Edition, and includes hundreds of puzzles, plots, and enigmas that can be at the heart of compelling campaigns. The Sixth World Tarot comes complete with 78 full-color tarot cards and a guidebook. The cards are 2.5' x 5' tall, with gilded edges.",
	"edition": 5,
	"publisher": ["Catalyst Game Labs", "Pegasus Spiele"],
	"releaseDate": ["2016-01-01"],
	"gameDate": "2075-01",
	"status": "outofscope",
	"cover": "./cover.jpg"
}
