{
	"$schema": "../$schemas/data.schema.json",
	"sku": ["SOK207"],
	"name": "Shadowland #7",
	"category": "magazine",
	"type": "ocr",
	"originalLanguage": "en-US",
	"description": "The cover is not included in the page numbers.\nIndex:\nFront page (Mark Nelson)\n1 Index & Credits\n2 Download (Editorial - Chris Hussey)\n3 Expect the Unexpected (Fiction - Andrew Hamilton)\n6 Getting Physical (Physical Adept powers - Ken Sato)\n7 Friendship & Honor (Fiction - Steven Warnock)\n12 Gen Con Wrap-up\n13 Technobabel (Preview - Steven Kenson)\n15 Cyberpirates Preview\n17 The Knight Shift (Prime Runners - Unknown)\n28 The New Tools of Anti-Social Behavior (Firearms - Brian Downes)\n31 Gotcha! (Hit locations - Ben Zitterkoph, Jason Shockley)\n33 Nature's Shadows (Plant Totems - Anonymous)\n37 Nothing Personal - Just Business (Fiction - Jon Szeto)\n46 Shadowrun CCG List (Mike Mulvihill)\n49 High Noon (Fiction - Jay Fugiel)\n50 Way of the hunter (Physical Adept path, skills & powers - Jonathan Szeto)\n52 Hermetic Lodge (Spells - Chris Hussey)\n54 Newsline (News from the Shadowrun universe)\n55 Writer's Guidelines\n56 Shadowland Disclosure Form",
	"edition": 2,
	"publisher": ["Other"],
	"releaseDate": ["1997-01-01"],
	"gameDate": "2054-01",
	"status": "ok",
	"cover": "./cover.jpg"
}
